{
  "$schema": "https://json-schema.org/draft/2020-12/schema",
  "title": "AuditExport",
  "type": "object",
  "required": ["format", "exported_at", "filters", "records"],
  "properties": {
    "format": {
      "type": "string",
      "const": "divinity.audit.v1"
    },
    "exported_at": {
      "type": "string",
      "format": "date-time"
    },
    "filters": {
      "type": "object",
      "required": ["from", "to"],
      "properties": {
        "from": { "type": ["string", "null"], "format": "date-time" },
        "to": { "type": ["string", "null"], "format": "date-time" }
      },
      "additionalProperties": false
    },
    "records": {
      "type": "array",
      "items": {
        "type": "object",
        "required": ["audit_id", "type", "run_id", "created_at", "payload", "hash"],
        "properties": {
          "audit_id": { "type": "string" },
          "type": {
            "type": "string",
            "enum": ["run_created", "run_event", "approval_decision", "approval_comment", "approval_revision", "provider_tool_call_approval", "provider_tool_execution", "provider_secret_readiness", "provider_secret_ref", "goal_record", "artifact_record", "execution_record", "verification_record", "execution_lock_record", "heartbeat_record", "workspace_cleaned", "connector_reference", "budget_incident"]
          },
          "run_id": { "type": "string" },
          "created_at": { "type": "string", "format": "date-time" },
          "payload": { "type": "object" },
          "hash": {
            "type": "string",
            "pattern": "^[a-f0-9]{64}$"
          }
        },
        "additionalProperties": false
      }
    }
  },
  "additionalProperties": false
}
