{
  "format": "divinity.audit.v1",
  "exported_at": "2026-05-24T00:00:00Z",
  "filters": {
    "from": "2026-05-24T00:00:00Z",
    "to": null
  },
  "records": [
    {
      "audit_id": "audit_123",
      "type": "run_event",
      "run_id": "run_123",
      "created_at": "2026-05-24T00:00:00Z",
      "payload": {
        "status": "queued"
      },
      "hash": "aaaaaaaaaaaaaaaaaaaaaaaaaaaaaaaaaaaaaaaaaaaaaaaaaaaaaaaaaaaaaaaa"
    }
  ]
}
